{
  "assumptions": [],
  "constituents": [
    {
      "constituent_id": "fecal_coliform",
      "notes": null,
      "role": "gating",
      "source_basis": "regulatory_default",
      "source_concentration": null,
      "use_governed_default": true
    },
    {
      "constituent_id": "nitrate_as_N",
      "notes": null,
      "role": "reference_only",
      "source_basis": "regulatory_default",
      "source_concentration": null,
      "use_governed_default": true
    }
  ],
  "groundwater": {
    "depth_to_groundwater_m": 4.5,
    "hydraulic_gradient": 0.01
  },
  "physics": {
    "dispersivity_method": "epa_ssg",
    "engine": "ogata_banks_1d"
  },
  "project": {
    "county": "County, State",
    "description": null,
    "engineer": "EOR, P.E.",
    "name": "Fixture Site",
    "regulatory_authority": "30 TAC Ch. 285 (OSSF rules)"
  },
  "receptors": [
    {
      "active": true,
      "display_name": "On-site private well",
      "distance_m": 30.5,
      "notes": null,
      "receptor_id": "well_onsite",
      "receptor_type": "private_well"
    },
    {
      "active": true,
      "display_name": "Adjacent well",
      "distance_m": 45.7,
      "notes": null,
      "receptor_id": "well_adjacent",
      "receptor_type": "private_well"
    }
  ],
  "regulatory_location": {
    "coastal_zone": false,
    "edwards_aquifer_contributing_zone": false,
    "edwards_aquifer_recharge_zone": false,
    "edwards_aquifer_transition_zone": false,
    "karst_terrain": true,
    "notes": null
  },
  "reporting": {
    "comparison_soil_ids": [],
    "notes": null
  },
  "schema_version": "ossf-site-case-1.0.0",
  "site_id": "REFUSE-001",
  "source": {
    "description": null,
    "design_flow_gpd": 360.0
  },
  "subsurface": {
    "soil_id": "clay_loam",
    "soil_thickness_m": 3.0
  },
  "treatment": {
    "disinfection_method": "chlorine",
    "disinfection_status": "disinfected",
    "notes": null,
    "treatment_level": "secondary"
  }
}
